{
  "documentType": "d2p:revision",
  "schemaVersion": "1.0.0",
  "revisionId": "rev_conformance-square-r2",
  "artifactId": "art_conformance-square",
  "sequence": 2,
  "parentRevisionIds": [
    "rev_conformance-square-r1"
  ],
  "contentDigest": "sha256:ac4eba00295efdf7bc5fb11278fab62fe75757e4ff2cc9da3543552b5948f0f9",
  "createdAt": "2026-01-02T00:00:00Z",
  "author": {
    "kind": "system",
    "principalId": "prn_conformance-kit"
  },
  "commandId": "cmd_conformance-edit-1"
}
